{
  "packet_id": "PKT-BM-007",
  "source": {
    "type": "filing",
    "url": "https://investor.pddholdings.com/news-releases",
    "title": "PDD Holdings Business Model Quality Assessment - Synthesized from SEC Filings, XBRL, and Earnings Releases",
    "retrieved_at": "2026-03-20T07:00:00Z",
    "collector": "business-model-analyst"
  },
  "extractions": [
    {
      "claim": "PDD operates a dual-engine model: Pinduoduo (domestic profit engine, pure marketplace) + Temu (international growth/investment engine, managed marketplace transitioning to semi-managed)",
      "evidence": "Pinduoduo domestic: Pure marketplace model, merchants set prices, platform earns ad fees (CPC auctions) + transaction commissions. Revenue recognized NET. Estimated GMV ~RMB 4-5T. Highly profitable with operating margins likely 40%+ at segment level (not disclosed). Temu international: Fully-managed marketplace (transitioning ~29% to semi-managed as of Q3 2025). Platform sets consumer prices, handles logistics. Revenue recognized GROSS for fully-managed, NET for semi-managed. Investment phase with heavy marketing spend but approaching breakeven in US market.",
      "evidence_type": "computed_metric",
      "verification": {
        "status": "extrapolated",
        "verifier_notes": "PDD does not provide segment profitability. Pinduoduo margin estimate based on: consolidated FY2024 operating margin was 27.5% despite Temu losses, implying domestic margins well above 30%."
      }
    },
    {
      "claim": "PDD's primary revenue driver is advertising (online marketing services), which is the highest-quality revenue stream in e-commerce -- highest margin, most scalable, most defensible",
      "evidence": "Online marketing services represented 50.3% of FY2024 revenue (RMB 197.9B) and historically 62% in FY2023. This is CPC/CPM advertising revenue from merchants competing for visibility on the platform. Ad revenue characteristics: near-100% incremental margin (no COGS), scales with GMV and merchant count, benefits from network effects (more buyers -> more merchants -> higher ad prices). Transaction services (49.7% of FY2024 revenue) are lower quality but still high margin -- driven by payment processing and commission fees.",
      "evidence_type": "computed_metric",
      "verification": {
        "status": "supported",
        "verifier_notes": "Revenue mix from quarterly earnings releases"
      }
    },
    {
      "claim": "Business model quality thesis: PDD has the best unit economics in Chinese e-commerce but faces a quality inflection -- the margin compression in 2025 reflects a strategic choice, not structural deterioration",
      "evidence": "FY2024 operating margin 27.5% -> 9M 2025 operating margin 21.7%. This compression is DELIBERATE: management invested heavily in merchant subsidies, fee reductions, and ecosystem support (S&M expenses +43% in Q1 2025). The cash pile grew from RMB 331.6B to RMB 423.8B during this period, confirming the business still generates massive free cash flow. This is analogous to Amazon's 2014-2018 investment cycle. The question is whether PDD can re-expand margins once investments mature.",
      "evidence_type": "computed_metric",
      "verification": {
        "status": "extrapolated",
        "verifier_notes": "Margin compression and cash pile growth confirmed from filings. Strategic intent interpretation from earnings call commentary."
      }
    },
    {
      "claim": "Revenue quality score: HIGH. Three mutually reinforcing revenue streams (ads + commissions + float income) with no fintech regulatory risk, but concentration risk in Chinese consumer spending and regulatory overhang from VIE structure and US-China tensions",
      "evidence": "Revenue quality factors: (1) Ad revenue = highest quality, near-zero marginal cost, scales with engagement. (2) Transaction commissions = high quality, scales with GMV, predictable. (3) Investment income = high quality, RMB 20.5B/year from RMB 400B+ cash earning ~5% yield, but non-operational. Risk factors: (1) No segment disclosure means investors cannot independently assess Pinduoduo vs Temu profitability. (2) VIE structure means investors own contractual rights, not equity in operating entities. (3) De minimis exemption changes threaten Temu's US business model. (4) Chinese regulatory unpredictability (cf. Alibaba antitrust fine of 2021).",
      "evidence_type": "computed_metric",
      "verification": {
        "status": "extrapolated",
        "verifier_notes": "Synthesized assessment from all prior evidence packets"
      }
    }
  ],
  "metadata": {
    "freshness": "2026-03",
    "company_tags": ["PDD", "pdd-holdings", "pinduoduo", "temu"],
    "topic_tags": ["business-model", "revenue-quality", "dual-engine", "thesis"]
  }
}
