{
  "packet_id": "PKT-REG-CN-001",
  "source": {
    "type": "article",
    "url": "https://www.chinadaily.com.cn/a/202512/31/WS69547f25a310d6866eb3159c.html",
    "title": "China SAMR Antitrust and Regulatory Environment for Pinduoduo/PDD Holdings",
    "retrieved_at": "2026-03-20T06:38:00Z",
    "collector": "regulatory-policy-reader"
  },
  "extractions": [
    {
      "claim": "Pinduoduo became China's largest e-commerce platform by active users (March 2021) and by share value (2024), benefiting from lighter regulatory treatment than Alibaba",
      "evidence": "In March 2021, Pinduoduo became the biggest e-commerce platform in China in terms of active end users, and it also became the biggest e-commerce platform in terms of share value in 2024. The quick rise of Pinduoduo and its ability to challenge Alibaba suggests strong competitive dynamics in the e-commerce market.",
      "evidence_type": "direct_quote",
      "verification": {
        "status": "supported",
        "verifier_notes": "Source: Academic research and ProMarket analysis"
      }
    },
    {
      "claim": "Alibaba received RMB 18.23B ($2.78B) SAMR antitrust fine in 2021 for 'pick one from two' exclusivity; PDD received only minor fines for community group buying",
      "evidence": "SAMR investigated Alibaba Group for using its dominant market position to force merchants into exclusive 'pick one from two' deals. The penalty was RMB 18.23 billion (approximately USD $2.78 billion), the heaviest antitrust financial penalty ever. China has also imposed fines on Pinduoduo for unfair competition related to predatory pricing in community group buying, but these were much smaller.",
      "evidence_type": "direct_quote",
      "verification": {
        "status": "supported",
        "verifier_notes": "Source: SAMR enforcement records; ScienceDirect academic paper"
      }
    },
    {
      "claim": "SAMR 2026 priorities focus on curbing 'cutthroat competition' and new platform-economy regulations nearing completion",
      "evidence": "China will step up antitrust enforcement, rein in cutthroat competition, and better develop the platform economy as part of its market regulation priorities for 2026. SAMR is preparing new and revised measures including updated rules on monopolistic agreements, new regulations targeting government restrictions on competition, and expanded oversight of digital platforms. Platform-economy regulations nearing completion.",
      "evidence_type": "direct_quote",
      "verification": {
        "status": "supported",
        "verifier_notes": "Source: China Daily Dec 31, 2025; BRICS Competition analysis"
      }
    },
    {
      "claim": "SAMR total antitrust fines to date exceed RMB 22 billion across 107 decisions by end of 2024",
      "evidence": "By the end of 2024, SAMR had entered into 107 decisions, including four cases of abuse, one blocked merger case, and 102 cases regarding non-notified mergers. The total antitrust fines imposed amount to over 22 billion RMB.",
      "evidence_type": "direct_quote",
      "verification": {
        "status": "supported",
        "verifier_notes": "Source: Merger Control Laws and Regulations Report 2026 China (ICLG)"
      }
    },
    {
      "claim": "PDD Holdings 20-F risk factors cite Anti-monopoly Law compliance, VIE structure risks, CSRC approval requirements, and data security (PIPL) obligations",
      "evidence": "20-F risk factors include: business practices such as deploying big data analytics to set discriminatory terms, coercive exclusivity arrangements, blocking of competitor interfaces, and unlawful collection of user data are prohibited. Heightened regulatory scrutiny under the Anti-monopoly Law may increase compliance costs. VIE structure means PDD Holdings has no equity ownership in operating entities. Cash restrictions may limit cross-border fund transfers.",
      "evidence_type": "direct_quote",
      "verification": {
        "status": "supported",
        "verifier_notes": "Source: PDD Holdings 20-F filed April 28, 2025 with SEC"
      }
    },
    {
      "claim": "Current China regulatory stance is supportive of platform economy growth post-2023 relaxation",
      "evidence": "China's antitrust enforcement focuses on firm-specific violations rather than the entire e-commerce industry. Pinduoduo achieved exceptional growth from 2020 to 2023. The tech regulation cycle peaked 2021-2022 and relaxed since 2023. Current stance is supportive of platform economy growth, though SAMR's 2026 'cutthroat competition' focus could theoretically target PDD's aggressive pricing practices.",
      "evidence_type": "computed_metric",
      "verification": {
        "status": "extrapolated",
        "verifier_notes": "Synthesis from multiple academic and legal sources on China regulatory posture"
      }
    }
  ],
  "metadata": {
    "freshness": "2026-03",
    "company_tags": ["PDD", "pdd-holdings", "Pinduoduo", "拼多多"],
    "topic_tags": ["regulatory", "SAMR", "antitrust", "China", "VIE", "data-security", "PIPL"],
    "severity_assessment": {
      "action": "China SAMR antitrust and regulatory environment for Pinduoduo",
      "severity": "cosmetic",
      "rationale": "Pinduoduo has been a relative beneficiary of China's antitrust cycle. Alibaba's $2.78B fine in 2021 actually helped PDD by weakening its chief competitor. PDD's own fines for community group buying were minor. Current regulatory posture is supportive of platform economy. VIE structure risk is theoretical but universal to all Chinese ADR holders. SAMR's 2026 focus on 'cutthroat competition' is a latent risk given PDD's aggressive pricing, but no specific enforcement action has been taken. Compared to Alibaba/JD, PDD faces lighter domestic regulatory burden.",
      "status": "monitoring",
      "next_milestone": "New platform-economy regulations expected 2026; SAMR 'cutthroat competition' enforcement pattern to watch"
    }
  }
}
